Uuid,Void/Retire,Name,Description,View privilege,Edit privilege,_order:1000
ca3aed11-1aa4-42a1-b85c-8332fc8001fc,,Check In,Indicates the patient has done the required paperwork and check-in to begin a visit to the clinic/hospital.,,,
67a71486-1a54-468f-ac3e-7091a9a79584,,Vitals,For capturing vital signs,,,
e22e39fd-7db2-45e7-80f1-60fa0d5a4378,,Admission,"Indicates that the patient has been admitted for inpatient care, and is not expected to leave the hospital unless discharged.",,,
181820aa-88c9-479b-9077-af92f5364329,,Discharge,"Indicates that a patient's inpatient care at the hospital is ending, and they are expected to leave soon.",,,
d7151f82-c1f3-4152-a605-2f9ea7414a79,,Visit Note,"Encounter where a full or abbreviated examination is done, usually leading to a presumptive or confirmed diagnosis, recorded by the examining clinician.",,,
25a042b2-60bc-4940-a909-debd098b7d82,,Check Out,The patient is explicitly leaving the hospital/clinic. (Usually no formal encounter is captured for this.),,,
7b68d557-85ef-4fc8-b767-4fa4f5eb5c23,,Intra-Hospital Transfer,Indicates that a patient is being transferred into a different department within the hospital. (Transfers out of the hospital should not use this encounter type.),,,
5021b1a1-e7f6-44b4-ba02-da2f2bcf8718,,Attachment Upload,Encounters used to record uploads of attachments.,,,
