Uuid,Void/Retire,Name,Description,_version:1,Parent Visit Type
b1f0e8a1-9c5d-4f0e-8892-81f3140fbc09,,Consulta Ambulatoria,"Atención ambulatoria en consultorio médico para cuidados generales o especializados, sin requerir hospitalización. Referenciado en la NTS N° 035-MINSA.",1,
f70a865a-6cae-4d04-8d05-acb5bf88fa16,,Consulta Ambulatoria - Medicina General,"Consulta ambulatoria de medicina general para atención integral del paciente.",1,b1f0e8a1-9c5d-4f0e-8892-81f3140fbc09
00d5ce5a-5211-4dfb-b9dd-d551bc7d1afd,,Consulta Ambulatoria - Ginecología,"Consulta ambulatoria especializada en ginecología para atención de la salud reproductiva femenina.",1,b1f0e8a1-9c5d-4f0e-8892-81f3140fbc09
19fa588e-3185-41c2-a5d1-21c3a4af944b,,Consulta Ambulatoria - Obstetricia,"Consulta ambulatoria especializada en obstetricia para control prenatal y atención del embarazo.",1,b1f0e8a1-9c5d-4f0e-8892-81f3140fbc09
ae40aab4-c57d-4bb1-a27e-2cacc24dd07f,,Consulta Ambulatoria - Odontología,"Consulta ambulatoria especializada en odontología para atención de salud bucal y dental.",1,b1f0e8a1-9c5d-4f0e-8892-81f3140fbc09
61e8b805-136e-44fa-ac81-7a5ccd65f881,,Consulta Ambulatoria - Pediatría,"Consulta ambulatoria especializada en pediatría para atención de niños y adolescentes.",1,b1f0e8a1-9c5d-4f0e-8892-81f3140fbc09
54cd95e3-5fdf-4339-b717-3c649b0cad0c,,Consulta Ambulatoria - Cardiología,"Consulta ambulatoria especializada en cardiología para atención de enfermedades cardiovasculares.",1,b1f0e8a1-9c5d-4f0e-8892-81f3140fbc09
dfd5a7e3-f61e-4275-af45-70eff9070c4b,,Consulta Ambulatoria - Neurología,"Consulta ambulatoria especializada en neurología para atención de enfermedades del sistema nervioso.",1,b1f0e8a1-9c5d-4f0e-8892-81f3140fbc09
e3045dfa-22c5-4bec-8856-46e3faab996a,,Consulta Ambulatoria - Oncología,"Consulta ambulatoria especializada en oncología para atención de enfermedades neoplásicas.",1,b1f0e8a1-9c5d-4f0e-8892-81f3140fbc09
560864ec-38ef-4c51-9b22-ec10de234f57,,Consulta Ambulatoria - Psicología,"Consulta ambulatoria especializada en psicología para atención de salud mental.",1,b1f0e8a1-9c5d-4f0e-8892-81f3140fbc09
794d8ac5-924e-455a-bbdc-365c1ef009f7,,Consulta Ambulatoria - Psiquiatría,"Consulta ambulatoria especializada en psiquiatría para atención de trastornos mentales.",1,b1f0e8a1-9c5d-4f0e-8892-81f3140fbc09
e4c8b6d9-7f3a-4e7b-91a2-58b9f6c2d4b5,,Hospitalización,"Servicio de hospitalización que requiere el internamiento del paciente para recibir tratamientos médicos o quirúrgicos. Conforme a la NTS N° 032-MINSA.",1,
f8238c67-4514-46d2-87d0-330b64c7638e,,Hospitalización - Medicina Interna,"Hospitalización en servicio de medicina interna para tratamiento de patologías médicas complejas.",1,e4c8b6d9-7f3a-4e7b-91a2-58b9f6c2d4b5
f8238c67-4514-46d2-87d0-330b64c76311,,Hospitalización - Cirugía General,"Hospitalización en servicio de cirugía general para procedimientos quirúrgicos.",1,e4c8b6d9-7f3a-4e7b-91a2-58b9f6c2d4b5
f8238c67-4514-46d2-87d0-330b64c76312,,Hospitalización - Ginecología,"Hospitalización en servicio de ginecología para tratamientos especializados en salud femenina.",1,e4c8b6d9-7f3a-4e7b-91a2-58b9f6c2d4b5
f8238c67-4514-46d2-87d0-330b64c76313,,Hospitalización - Obstetricia,"Hospitalización en servicio de obstetricia para atención del parto y complicaciones obstétricas.",1,e4c8b6d9-7f3a-4e7b-91a2-58b9f6c2d4b5
f8238c67-4514-46d2-87d0-330b64c76314,,Hospitalización - Pediatría,"Hospitalización en servicio de pediatría para tratamiento de enfermedades infantiles.",1,e4c8b6d9-7f3a-4e7b-91a2-58b9f6c2d4b5
f8238c67-4514-46d2-87d0-330b64c76315,,Hospitalización - Neonatología,"Hospitalización en servicio de neonatología para atención de recién nacidos.",1,e4c8b6d9-7f3a-4e7b-91a2-58b9f6c2d4b5
f8238c67-4514-46d2-87d0-330b64c76316,,Hospitalización - UCI Adultos,"Hospitalización en unidad de cuidados intensivos para pacientes adultos críticos.",1,e4c8b6d9-7f3a-4e7b-91a2-58b9f6c2d4b5
f8238c67-4514-46d2-87d0-330b64c76317,,Hospitalización - UCI Pediátrica,"Hospitalización en unidad de cuidados intensivos pediátrica para niños en estado crítico.",1,e4c8b6d9-7f3a-4e7b-91a2-58b9f6c2d4b5
c2a1d3e2-4b8f-4326-94d9-7f6c9a1b7c98,,Emergencia,"Servicio de emergencia para atención inmediata en casos agudos o críticos, sin internamiento hospitalario. Conforme a la NTS N° 021-MINSA.",1,
c2a1d3e2-4b8f-4326-94d9-7f6c9a1b7c00,,Emergencia - Trauma Shock,"Atención de emergencia en unidad de trauma shock para casos críticos y politraumatizados.",1,c2a1d3e2-4b8f-4326-94d9-7f6c9a1b7c98
c2a1d3e2-4b8f-4326-94d9-7f6c9a1b7c01,,Emergencia - Medicina,"Atención de emergencia médica para patologías agudas no quirúrgicas.",1,c2a1d3e2-4b8f-4326-94d9-7f6c9a1b7c98
c2a1d3e2-4b8f-4326-94d9-7f6c9a1b7c02,,Emergencia - Cirugía,"Atención de emergencia quirúrgica para casos que requieren intervención inmediata.",1,c2a1d3e2-4b8f-4326-94d9-7f6c9a1b7c98
c2a1d3e2-4b8f-4326-94d9-7f6c9a1b7c03,,Emergencia - Pediatría,"Atención de emergencia pediátrica para casos agudos en niños y adolescentes.",1,c2a1d3e2-4b8f-4326-94d9-7f6c9a1b7c98
c2a1d3e2-4b8f-4326-94d9-7f6c9a1b7c04,,Emergencia - Obstetricia,"Atención de emergencia obstétrica para complicaciones del embarazo y parto.",1,c2a1d3e2-4b8f-4326-94d9-7f6c9a1b7c98
110001d9-7f3a-4e7b-91a2-580b216a7c42,,Dispensación de Medicamentos,"Servicio de farmacia encargado de la dispensación y control de medicamentos conforme a las prescripciones médicas. Según la NTS N° 139-MINSA.",1,
m6d9a5c3-4e7b-48f1-9d2e-8a5b7c2d3e9f,,Procedimientos Especializados,"Servicio central de esterilización para el procesamiento, desinfección y esterilización de materiales médicos y quirúrgicos. Conforme a la NTS N° 080-MINSA.",1,
jcd1f4a7-5b3e-48c9-84a5-1500006a7c44,,Consulta Diagnóstica,"Servicio de patología clínica que realiza análisis de muestras biológicas para apoyar el diagnóstico de enfermedades. Según la NTS N° 025-MINSA.",1,
m6d9a5c3-4e7b-48f1-9d2e-111111111111,,Atención Extramural,"Servicio central de esterilización para el procesamiento, desinfección y esterilización de materiales médicos y quirúrgicos. Conforme a la NTS N° 080-MINSA.",1,