Uuid,Void/Retire,Same as mappings,Fully specified name:en,Fully specified name:fr,Fully specified name:es,Short name:en,Short name:fr,Short name:es,Description:en,Description:fr,Description:es,Data class,Data type,_version:1,_order:1000
7dc376cc-1725-11ed-861d-0242ac120002,,SNOMED MVP:PMTCT,Prevention of Maternal to Child HIV transmissio,,,PMTCT,,,Prevention of Maternal to Child HIV transmission program,,,Misc,N/A,,
7dc379f6-1725-11ed-861d-0242ac120002,,SNOMED MVP:HIV_TS,HIV treatment status,,,Treatment status (HIV),,,HIV treatment status program workflow,,,Misc,N/A,,
7dc37ad2-1725-11ed-861d-0242ac120002,,SNOMED MVP:PROGRAM_STATUS,Program status,,,Program status,,,Program status program workflow,,,Misc,N/A,,
7dc37bb8-1725-11ed-861d-0242ac120002,,SNOMED MVP:OATT,On Antiretrovirals Treatment,,,On Antiretrovirals,,,On Antiretrovirals Treatment program workflow state,,,Misc,N/A,,
7dc37c9e-1725-11ed-861d-0242ac120002,,SNOMED MVP:LTFU,Lost to follow-up,,,Lost follow-up,,,Lost to follow-up program workflow state,,,Misc,N/A,,
7dc37d7a-1725-11ed-861d-0242ac120002,,SNOMED MVP:NS,Never started,,,Never started,,,Never started program workflow state,,,Misc,N/A,,
